{
  "artifactPaths": {
    "descriptor": "data/world/pilots/chunk_0_1.json",
    "manifest": "data/world/compiled/world_manifest.json",
    "runtimeResolution": "import.meta.env.BASE_URL"
  },
  "capacities": [
    {
      "assetId": "proto-biome-crystal",
      "maximumActiveInstances": 2304
    },
    {
      "assetId": "proto-biome-rock",
      "maximumActiveInstances": 2304
    },
    {
      "assetId": "proto-biome-snow",
      "maximumActiveInstances": 2304
    },
    {
      "assetId": "proto-biome-water",
      "maximumActiveInstances": 2304
    }
  ],
  "chunk": {
    "boundsXZ": {
      "maximum": [
        640,
        1920
      ],
      "minimum": [
        -640,
        640
      ]
    },
    "center": [
      0,
      0,
      1280
    ],
    "coordinates": [
      0,
      1
    ],
    "id": "chunk:0:1",
    "sizeMeters": 1280
  },
  "compilerContractVersion": "1.0.0",
  "dataRevision": "917550d",
  "declaredAssetIds": [
    "existing-streamed-terrain",
    "proto-biome-crystal",
    "proto-biome-rock",
    "proto-biome-snow",
    "proto-biome-water"
  ],
  "descriptorId": "pilot-chunk-near-airport-arctic-tundra",
  "fallback": {
    "required": true,
    "source": "current-procedural-descriptor"
  },
  "originReservation": {
    "enforced": true,
    "halfExtentMeters": 430,
    "rule": "reject-placement-when-max-absolute-world-xz-is-less-than-half-extent"
  },
  "prototypeBatches": [
    {
      "assetId": "proto-biome-crystal",
      "transforms": [
        {
          "colorLinearRgb": [
            0.2581828534603119,
            0.6583748459815979,
            0.7379103899002075
          ],
          "rotation": [
            0,
            0.23310500383377075,
            0,
            0.9724515676498413
          ],
          "scale": [
            2.6133193969726562,
            15.699055671691895,
            3.180687665939331
          ],
          "translation": [
            -121.63870239257812,
            8.962817192077637,
            -204.99127197265625
          ]
        },
        {
          "colorLinearRgb": [
            0.7379103899002075,
            0.9215818643569946,
            0.9130986332893372
          ],
          "rotation": [
            0,
            0.7264541387557983,
            0,
            0.6872149705886841
          ],
          "scale": [
            1.7621902227401733,
            7.467951774597168,
            1.9550166130065918
          ],
          "translation": [
            161.8827362060547,
            5.133454322814941,
            -194.3301239013672
          ]
        },
        {
          "colorLinearRgb": [
            0.2581828534603119,
            0.6583748459815979,
            0.7379103899002075
          ],
          "rotation": [
            0,
            0.329853892326355,
            0,
            0.9440320134162903
          ],
          "scale": [
            2.4978575706481934,
            6.690526485443115,
            2.0935842990875244
          ],
          "translation": [
            -491.00885009765625,
            11.261101722717285,
            -402.68328857421875
          ]
        },
        {
          "colorLinearRgb": [
            0.7379103899002075,
            0.9215818643569946,
            0.9130986332893372
          ],
          "rotation": [
            0,
            0.734995424747467,
            0,
            0.6780720353126526
          ],
          "scale": [
            2.8619210720062256,
            6.588188171386719,
            1.3229907751083374
          ],
          "translation": [
            80.40161895751953,
            7.971756458282471,
            -250.64114379882812
          ]
        },
        {
          "colorLinearRgb": [
            0.2581828534603119,
            0.6583748459815979,
            0.7379103899002075
          ],
          "rotation": [
            0,
            0.4325847923755646,
            0,
            0.9015932679176331
          ],
          "scale": [
            3.3819479942321777,
            18.533479690551758,
            1.9932565689086914
          ],
          "translation": [
            179.7154998779297,
            8.906399726867676,
            -413.7386474609375
          ]
        },
        {
          "colorLinearRgb": [
            0.2581828534603119,
            0.6583748459815979,
            0.7379103899002075
          ],
          "rotation": [
            0,
            0.5593724846839905,
            0,
            0.8289164304733276
          ],
          "scale": [
            1.4234579801559448,
            9.042081832885742,
            1.5255662202835083
          ],
          "translation": [
            -94.62816619873047,
            9.56617546081543,
            -163.49807739257812
          ]
        },
        {
          "colorLinearRgb": [
            0.7379103899002075,
            0.9215818643569946,
            0.9130986332893372
          ],
          "rotation": [
            0,
            0.996147632598877,
            0,
            0.08769218623638153
          ],
          "scale": [
            3.344008207321167,
            12.407879829406738,
            2.308072805404663
          ],
          "translation": [
            -465.6209716796875,
            10.627463340759277,
            -401.5050354003906
          ]
        },
        {
          "colorLinearRgb": [
            0.2581828534603119,
            0.6583748459815979,
            0.7379103899002075
          ],
          "rotation": [
            0,
            0.18282867968082428,
            0,
            0.9831447601318359
          ],
          "scale": [
            1.5761263370513916,
            8.076961517333984,
            2.5634207725524902
          ],
          "translation": [
            263.6287841796875,
            3.1301536560058594,
            -163.99615478515625
          ]
        },
        {
          "colorLinearRgb": [
            0.7379103899002075,
            0.9215818643569946,
            0.9130986332893372
          ],
          "rotation": [
            0,
            0.7024118304252625,
            0,
            0.71177077293396
          ],
          "scale": [
            1.2947016954421997,
            16.077035903930664,
            3.543813705444336
          ],
          "translation": [
            -448.06781005859375,
            7.554050922393799,
            -468.685546875
          ]
        },
        {
          "colorLinearRgb": [
            0.2581828534603119,
            0.6583748459815979,
            0.7379103899002075
          ],
          "rotation": [
            0,
            0.9906135201454163,
            0,
            0.13669240474700928
          ],
          "scale": [
            1.844018578529358,
            17.511028289794922,
            1.4075285196304321
          ],
          "translation": [
            3.001725196838379,
            8.076799392700195,
            -83.9699935913086
          ]
        },
        {
          "colorLinearRgb": [
            0.2581828534603119,
            0.6583748459815979,
            0.7379103899002075
          ],
          "rotation": [
            0,
            0.03914724662899971,
            0,
            0.9992334246635437
          ],
          "scale": [
            2.5757668018341064,
            11.780923843383789,
            3.447796106338501
          ],
          "translation": [
            96.00435638427734,
            9.386667251586914,
            -114.28182983398438
          ]
        },
        {
          "colorLinearRgb": [
            0.7379103899002075,
            0.9215818643569946,
            0.9130986332893372
          ],
          "rotation": [
            0,
            0.5209792256355286,
            0,
            0.8535693287849426
          ],
          "scale": [
            2.4102580547332764,
            15.057150840759277,
            1.5292837619781494
          ],
          "translation": [
            -459.5535888671875,
            4.848888397216797,
            -236.2657012939453
          ]
        },
        {
          "colorLinearRgb": [
            0.2581828534603119,
            0.6583748459815979,
            0.7379103899002075
          ],
          "rotation": [
            0,
            0.9619848132133484,
            0,
            0.2731030285358429
          ],
          "scale": [
            3.4643170833587646,
            17.483104705810547,
            1.4852262735366821
          ],
          "translation": [
            -485.6026306152344,
            7.651556491851807,
            -260.0615539550781
          ]
        },
        {
          "colorLinearRgb": [
            0.7379103899002075,
            0.9215818643569946,
            0.9130986332893372
          ],
          "rotation": [
            0,
            0.4460028409957886,
            0,
            0.8950315713882446
          ],
          "scale": [
            3.401010036468506,
            17.176525115966797,
            2.1741156578063965
          ],
          "translation": [
            -451.44097900390625,
            9.104766845703125,
            -372.2268371582031
          ]
        },
        {
          "colorLinearRgb": [
            0.2581828534603119,
            0.6583748459815979,
            0.7379103899002075
          ],
          "rotation": [
            0,
            0.9972038269042969,
            0,
            0.07472971826791763
          ],
          "scale": [
            3.5490167140960693,
            6.627841472625732,
            2.697526693344116
          ],
          "translation": [
            99.68779754638672,
            6.73514461517334,
            -225.992919921875
          ]
        },
        {
          "colorLinearRgb": [
            0.2581828534603119,
            0.6583748459815979,
            0.7379103899002075
          ],
          "rotation": [
            0,
            0.8097220063209534,
            0,